Trial 0 using GPU 0
Trial 2 using GPU 1
wandb: Tracking run with wandb version 0.20.1
wandb: Run data is saved locally in /home/sethih1/masque_new/ters_gen/wandb/run-20251204_141657-7uvk0gn7
wandb: Run `wandb offline` to turn off syncing.
wandb: Syncing run trial_1_bs64_lr1e-04_dice_loss
wandb: ⭐️ View project at https://wandb.ai/sethih10-epfl/Extended_TERS_data_0.1
wandb: 🚀 View run at https://wandb.ai/sethih10-epfl/Extended_TERS_data_0.1/runs/7uvk0gn7
Trial 1 using GPU 2
Trial 3 using GPU 3
Epoch    1/50, time: 66.95 s, training_loss: 0.907
Epoch    1/50, time: 67.02 s, training_loss: 0.935
Epoch    1/50, time: 11.74 s, val_loss: 0.898
Epoch    1/50, time: 78.69 s, training_loss: 0.899
Epoch    1/50, time: 11.99 s, val_loss: 0.913
Epoch    1/50, time: 14.16 s, val_loss: 0.899
Exception in trial 0: softmax() received an invalid combination of arguments - got (Tensor), but expected one of:
 * (Tensor input, int dim, torch.dtype dtype = None, *, Tensor out = None)
 * (Tensor input, name dim, *, torch.dtype dtype = None)
Traceback (most recent call last):
  File "/home/sethih1/masque_new/ters_gen/hyperopt.py", line 143, in objective
    trainer.train(epochs=config.training.epochs)
  File "/home/sethih1/masque_new/ters_gen/src/trainer/trainer_image_to_image.py", line 89, in train
    self.evaluate_model_metrics(self.model, epoch)
  File "/home/sethih1/masque_new/ters_gen/src/trainer/trainer_image_to_image.py", line 206, in evaluate_model_metrics
    train_metrics = self.compute_metrics(model, train_loader)
                    ^^^^^^^^^^^^^^^^^^^^^^^^^^^^^^^^^^^^^^^^^
  File "/home/sethih1/masque_new/ters_gen/src/trainer/trainer_image_to_image.py", line 172, in compute_metrics
    outputs = torch.softmax(outputs)
              ^^^^^^^^^^^^^^^^^^^^^^
TypeError: softmax() received an invalid combination of arguments - got (Tensor), but expected one of:
 * (Tensor input, int dim, torch.dtype dtype = None, *, Tensor out = None)
 * (Tensor input, name dim, *, torch.dtype dtype = None)

wandb:
wandb: 🚀 View run trial_0_bs32_lr2e-05_dice_loss at: https://wandb.ai/sethih10-epfl/Extended_TERS_data_0.1/runs/xgtfu1hr
wandb: ⭐️ View project at: https://wandb.ai/sethih10-epfl/Extended_TERS_data_0.1
wandb: Synced 5 W&B file(s), 0 media file(s), 0 artifact file(s) and 0 other file(s)
wandb: Find logs at: ./wandb/run-20251204_141657-xgtfu1hr/logs
[I 2025-12-04 14:18:36,968] Trial 0 finished with value: 0.0 and parameters: {'batch_size': 32, 'lr': 1.6397782915211407e-05, 'loss_fn': 'dice_loss', 'augmentation': True, 'filters_idx': 0, 'in_channels': 100, 'att_channels': 16}. Best is trial 0 with value: 0.0.
wandb: Finishing previous runs because reinit is set to True.
wandb:
wandb:
wandb: Run history:
wandb: final_dice ▁
wandb:      trial ▁
wandb:
wandb: Run summary:
wandb: final_dice 0
wandb:      trial 0
wandb:
wandb: 🚀 View run trial_1_bs64_lr1e-04_dice_loss at: https://wandb.ai/sethih10-epfl/Extended_TERS_data_0.1/runs/7uvk0gn7
wandb: ⭐️ View project at: https://wandb.ai/sethih10-epfl/Extended_TERS_data_0.1
wandb: Synced 5 W&B file(s), 0 media file(s), 0 artifact file(s) and 0 other file(s)
wandb: Find logs at: ./wandb/run-20251204_141657-7uvk0gn7/logs
wandb: Tracking run with wandb version 0.20.1
wandb: Run data is saved locally in /home/sethih1/masque_new/ters_gen/wandb/run-20251204_141836-yryrhxqr
wandb: Run `wandb offline` to turn off syncing.
wandb: Syncing run trial_4_bs128_lr4e-04_dice_loss
wandb: ⭐️ View project at https://wandb.ai/sethih10-epfl/Extended_TERS_data_0.1
wandb: 🚀 View run at https://wandb.ai/sethih10-epfl/Extended_TERS_data_0.1/runs/yryrhxqr

Trial 4 using GPU 0
Exception in trial 1: softmax() received an invalid combination of arguments - got (Tensor), but expected one of:
 * (Tensor input, int dim, torch.dtype dtype = None, *, Tensor out = None)
 * (Tensor input, name dim, *, torch.dtype dtype = None)
Traceback (most recent call last):
  File "/home/sethih1/masque_new/ters_gen/hyperopt.py", line 143, in objective
    trainer.train(epochs=config.training.epochs)
  File "/home/sethih1/masque_new/ters_gen/src/trainer/trainer_image_to_image.py", line 89, in train
    self.evaluate_model_metrics(self.model, epoch)
  File "/home/sethih1/masque_new/ters_gen/src/trainer/trainer_image_to_image.py", line 206, in evaluate_model_metrics
    train_metrics = self.compute_metrics(model, train_loader)
                    ^^^^^^^^^^^^^^^^^^^^^^^^^^^^^^^^^^^^^^^^^
  File "/home/sethih1/masque_new/ters_gen/src/trainer/trainer_image_to_image.py", line 172, in compute_metrics
    outputs = torch.softmax(outputs)
              ^^^^^^^^^^^^^^^^^^^^^^
TypeError: softmax() received an invalid combination of arguments - got (Tensor), but expected one of:
 * (Tensor input, int dim, torch.dtype dtype = None, *, Tensor out = None)
 * (Tensor input, name dim, *, torch.dtype dtype = None)

[I 2025-12-04 14:18:46,887] Trial 1 finished with value: 0.0 and parameters: {'batch_size': 64, 'lr': 0.00013433661551781796, 'loss_fn': 'dice_loss', 'augmentation': True, 'filters_idx': 1, 'in_channels': 100, 'att_channels': 32}. Best is trial 0 with value: 0.0.
wandb: Finishing previous runs because reinit is set to True.
wandb:
wandb:
wandb: Run history:
wandb: final_dice ▁
wandb:      trial ▁
wandb:
wandb: Run summary:
wandb: final_dice 0
wandb:      trial 1
wandb:
wandb: 🚀 View run trial_4_bs128_lr4e-04_dice_loss at: https://wandb.ai/sethih10-epfl/Extended_TERS_data_0.1/runs/yryrhxqr
wandb: ⭐️ View project at: https://wandb.ai/sethih10-epfl/Extended_TERS_data_0.1
wandb: Synced 5 W&B file(s), 0 media file(s), 0 artifact file(s) and 0 other file(s)
wandb: Find logs at: ./wandb/run-20251204_141836-yryrhxqr/logs
wandb: Tracking run with wandb version 0.20.1
wandb: Run data is saved locally in /home/sethih1/masque_new/ters_gen/wandb/run-20251204_141846-kx9kiyv2
wandb: Run `wandb offline` to turn off syncing.
wandb: Syncing run trial_5_bs16_lr1e-04_dice_loss
wandb: ⭐️ View project at https://wandb.ai/sethih10-epfl/Extended_TERS_data_0.1
wandb: 🚀 View run at https://wandb.ai/sethih10-epfl/Extended_TERS_data_0.1/runs/kx9kiyv2

Trial 5 using GPU 2
Exception in trial 2: softmax() received an invalid combination of arguments - got (Tensor), but expected one of:
 * (Tensor input, int dim, torch.dtype dtype = None, *, Tensor out = None)
 * (Tensor input, name dim, *, torch.dtype dtype = None)
Traceback (most recent call last):
  File "/home/sethih1/masque_new/ters_gen/hyperopt.py", line 143, in objective
    trainer.train(epochs=config.training.epochs)
  File "/home/sethih1/masque_new/ters_gen/src/trainer/trainer_image_to_image.py", line 89, in train
    self.evaluate_model_metrics(self.model, epoch)
  File "/home/sethih1/masque_new/ters_gen/src/trainer/trainer_image_to_image.py", line 206, in evaluate_model_metrics
    train_metrics = self.compute_metrics(model, train_loader)
                    ^^^^^^^^^^^^^^^^^^^^^^^^^^^^^^^^^^^^^^^^^
  File "/home/sethih1/masque_new/ters_gen/src/trainer/trainer_image_to_image.py", line 172, in compute_metrics
    outputs = torch.softmax(outputs)
              ^^^^^^^^^^^^^^^^^^^^^^
TypeError: softmax() received an invalid combination of arguments - got (Tensor), but expected one of:
 * (Tensor input, int dim, torch.dtype dtype = None, *, Tensor out = None)
 * (Tensor input, name dim, *, torch.dtype dtype = None)
