Trial 1 using GPU 0
Trial 3 using GPU 1
Trial 0 using GPU 2
Trial 2 using GPU 3
Epoch    1/50, time: 104.14 s, training_loss: 0.900
Epoch    1/50, time: 105.92 s, training_loss: 0.927
Epoch    1/50, time: 20.70 s, val_loss: 0.918
Epoch    1/50, time: 22.07 s, val_loss: 0.957
Epoch    1/50, time: 205.27 s, training_loss: 0.903
Epoch    1/50, time: 205.61 s, training_loss: 0.887
Training Metrics:
Accuracy: 0.9037
Precision: 0.1361
Recall: 0.6255
F1 Score: 0.2236
IoU: 0.1259
Dice Coefficient: 0.2236
Validation Metrics:
Accuracy: 0.8693
Precision: 0.1258
Recall: 0.8792
F1 Score: 0.2201
IoU: 0.1237
Dice Coefficient: 0.2201
Training Metrics:
Accuracy: 0.9776
Precision: 0.1419
Recall: 0.0020
F1 Score: 0.0039
IoU: 0.0020
Dice Coefficient: 0.0039
Validation Metrics:
Accuracy: 0.9787
Precision: 0.1430
Recall: 0.0030
F1 Score: 0.0059
IoU: 0.0029
Dice Coefficient: 0.0059
Epoch    1/50, time: 32.07 s, val_loss: 0.951
Epoch    1/50, time: 32.00 s, val_loss: 0.941
Epoch    2/50, time: 73.34 s, training_loss: 0.861
Epoch    2/50, time: 72.69 s, training_loss: 0.904
Epoch    2/50, time: 14.38 s, val_loss: 0.945
Epoch    2/50, time: 14.16 s, val_loss: 0.927
Epoch    3/50, time: 76.84 s, training_loss: 0.840
Epoch    3/50, time: 76.12 s, training_loss: 0.894
Epoch    3/50, time: 14.35 s, val_loss: 0.884
Epoch    3/50, time: 12.86 s, val_loss: 0.902
Epoch    4/50, time: 61.64 s, training_loss: 0.824
Epoch    4/50, time: 65.34 s, training_loss: 0.887
Epoch    4/50, time: 12.00 s, val_loss: 0.827
Epoch    4/50, time: 11.96 s, val_loss: 0.888
Training Metrics:
Accuracy: 0.9758
Precision: 0.1578
Recall: 0.0209
F1 Score: 0.0370
IoU: 0.0188
Dice Coefficient: 0.0370
Validation Metrics:
Accuracy: 0.9760
Precision: 0.1521
Recall: 0.0311
F1 Score: 0.0516
IoU: 0.0265
Dice Coefficient: 0.0516
Training Metrics:
Accuracy: 0.9758
Precision: 0.1574
Recall: 0.0205
F1 Score: 0.0363
IoU: 0.0185
Dice Coefficient: 0.0363
Validation Metrics:
Accuracy: 0.9753
Precision: 0.1528
Recall: 0.0385
F1 Score: 0.0615
IoU: 0.0318
Dice Coefficient: 0.0615
Epoch    5/50, time: 64.59 s, training_loss: 0.881
Epoch    5/50, time: 69.53 s, training_loss: 0.812
Epoch    5/50, time: 13.61 s, val_loss: 0.824
Epoch    5/50, time: 14.14 s, val_loss: 0.885
Epoch    6/50, time: 76.71 s, training_loss: 0.805
Epoch    6/50, time: 77.47 s, training_loss: 0.876
Epoch    6/50, time: 14.31 s, val_loss: 0.823
Epoch    6/50, time: 16.76 s, val_loss: 0.882
Epoch    7/50, time: 66.47 s, training_loss: 0.798
Epoch    2/50, time: 200.12 s, training_loss: 0.832
Epoch    7/50, time: 69.35 s, training_loss: 0.871
Epoch    2/50, time: 206.15 s, training_loss: 0.858
Epoch    7/50, time: 15.53 s, val_loss: 0.830
Epoch    7/50, time: 10.71 s, val_loss: 0.872
Epoch    2/50, time: 36.77 s, val_loss: 0.825
Epoch    2/50, time: 33.95 s, val_loss: 0.875
Epoch    8/50, time: 68.87 s, training_loss: 0.865
Epoch    8/50, time: 70.60 s, training_loss: 0.790
Epoch    8/50, time: 14.01 s, val_loss: 0.872
Epoch    8/50, time: 13.94 s, val_loss: 0.777
Epoch    9/50, time: 76.72 s, training_loss: 0.860
Epoch    9/50, time: 77.57 s, training_loss: 0.783
Epoch    9/50, time: 12.89 s, val_loss: 0.863
Epoch    9/50, time: 12.48 s, val_loss: 0.800
Epoch    3/50, time: 208.15 s, training_loss: 0.841
Epoch    3/50, time: 212.33 s, training_loss: 0.814
Epoch   10/50, time: 64.64 s, training_loss: 0.775
Epoch   10/50, time: 67.27 s, training_loss: 0.855
Epoch   10/50, time: 11.51 s, val_loss: 0.793
Epoch   10/50, time: 11.37 s, val_loss: 0.862
Epoch    3/50, time: 34.24 s, val_loss: 0.806
Epoch    3/50, time: 33.97 s, val_loss: 0.777
Epoch   11/50, time: 72.85 s, training_loss: 0.768
Epoch   11/50, time: 71.80 s, training_loss: 0.850
Epoch   11/50, time: 14.34 s, val_loss: 0.804
Epoch   11/50, time: 14.19 s, val_loss: 0.841
Training Metrics:
Accuracy: 0.7836
Precision: 0.0872
Recall: 0.9250
F1 Score: 0.1594
IoU: 0.0866
Dice Coefficient: 0.1594
Validation Metrics:
Accuracy: 0.8360
Precision: 0.1057
Recall: 0.9142
F1 Score: 0.1895
IoU: 0.1047
Dice Coefficient: 0.1895
Training Metrics:
Accuracy: 0.7976
Precision: 0.0913
Recall: 0.9087
F1 Score: 0.1660
IoU: 0.0905
Dice Coefficient: 0.1660
Validation Metrics:
Accuracy: 0.7793
Precision: 0.0812
Recall: 0.9226
F1 Score: 0.1492
IoU: 0.0806
Dice Coefficient: 0.1492
Epoch    4/50, time: 205.79 s, training_loss: 0.829
Epoch    4/50, time: 206.53 s, training_loss: 0.804
Epoch   12/50, time: 60.91 s, training_loss: 0.757
Epoch    4/50, time: 31.75 s, val_loss: 0.778
Epoch   12/50, time: 65.63 s, training_loss: 0.847
Epoch    4/50, time: 34.65 s, val_loss: 0.754
Epoch   12/50, time: 13.11 s, val_loss: 0.755
Epoch   12/50, time: 13.55 s, val_loss: 0.845
Epoch   13/50, time: 79.55 s, training_loss: 0.747
Epoch   13/50, time: 76.21 s, training_loss: 0.843
Epoch   13/50, time: 13.41 s, val_loss: 0.739
Epoch   13/50, time: 12.93 s, val_loss: 0.860
Epoch   14/50, time: 72.86 s, training_loss: 0.737
Epoch   14/50, time: 77.88 s, training_loss: 0.841
Epoch   14/50, time: 11.57 s, val_loss: 0.738
Epoch   14/50, time: 12.40 s, val_loss: 0.858
Epoch    5/50, time: 208.94 s, training_loss: 0.819
Epoch    5/50, time: 210.73 s, training_loss: 0.796
Epoch    5/50, time: 33.73 s, val_loss: 0.785
Epoch    5/50, time: 33.43 s, val_loss: 0.761
Epoch   15/50, time: 61.92 s, training_loss: 0.725
Epoch   15/50, time: 66.30 s, training_loss: 0.838
Epoch   15/50, time: 13.20 s, val_loss: 0.770
Epoch   15/50, time: 16.58 s, val_loss: 0.842
Epoch   16/50, time: 80.31 s, training_loss: 0.717
Epoch   16/50, time: 74.70 s, training_loss: 0.836
Epoch   16/50, time: 15.78 s, val_loss: 0.723
Epoch   16/50, time: 15.92 s, val_loss: 0.850
Epoch   17/50, time: 75.58 s, training_loss: 0.705
Epoch   17/50, time: 66.98 s, training_loss: 0.834
Epoch   17/50, time: 11.65 s, val_loss: 0.743
Epoch    6/50, time: 203.33 s, training_loss: 0.812
Epoch   17/50, time: 15.73 s, val_loss: 0.848
Epoch    6/50, time: 205.95 s, training_loss: 0.787
Epoch    6/50, time: 35.24 s, val_loss: 0.759
Epoch    6/50, time: 35.63 s, val_loss: 0.774
Epoch   18/50, time: 69.17 s, training_loss: 0.689
Epoch   18/50, time: 69.18 s, training_loss: 0.832
Epoch   18/50, time: 13.94 s, val_loss: 0.786
Epoch   18/50, time: 14.42 s, val_loss: 0.831
Epoch   19/50, time: 77.70 s, training_loss: 0.668
Epoch   19/50, time: 75.25 s, training_loss: 0.830
Epoch   19/50, time: 13.79 s, val_loss: 0.757
Epoch   19/50, time: 14.74 s, val_loss: 0.848
Epoch   20/50, time: 66.80 s, training_loss: 0.650
Epoch    7/50, time: 209.24 s, training_loss: 0.806
Epoch   20/50, time: 67.74 s, training_loss: 0.829
Epoch    7/50, time: 205.88 s, training_loss: 0.789
Epoch   20/50, time: 12.37 s, val_loss: 0.798
Epoch   20/50, time: 11.33 s, val_loss: 0.841
Epoch    7/50, time: 36.26 s, val_loss: 0.770
Epoch    7/50, time: 34.44 s, val_loss: 0.748
Epoch   21/50, time: 69.61 s, training_loss: 0.629
Epoch   21/50, time: 69.32 s, training_loss: 0.828
Epoch   21/50, time: 14.65 s, val_loss: 0.668
Epoch   21/50, time: 13.62 s, val_loss: 0.841
Training Metrics:
Accuracy: 0.8701
Precision: 0.1110
Recall: 0.6932
F1 Score: 0.1913
IoU: 0.1058
Dice Coefficient: 0.1913
Validation Metrics:
Accuracy: 0.8518
Precision: 0.0930
Recall: 0.6931
F1 Score: 0.1641
IoU: 0.0894
Dice Coefficient: 0.1641
Training Metrics:
Accuracy: 0.7378
Precision: 0.0723
Recall: 0.9155
F1 Score: 0.1341
IoU: 0.0718
Dice Coefficient: 0.1341
Validation Metrics:
Accuracy: 0.7233
Precision: 0.0651
Recall: 0.9124
F1 Score: 0.1215
IoU: 0.0647
Dice Coefficient: 0.1215
Epoch    8/50, time: 201.75 s, training_loss: 0.800
Epoch    8/50, time: 203.75 s, training_loss: 0.777
Epoch   22/50, time: 63.56 s, training_loss: 0.827
Epoch   22/50, time: 66.97 s, training_loss: 0.611
Epoch    8/50, time: 34.04 s, val_loss: 0.765
Epoch    8/50, time: 31.79 s, val_loss: 0.743
Epoch   22/50, time: 12.59 s, val_loss: 0.855
Epoch   22/50, time: 14.22 s, val_loss: 0.654
Epoch   23/50, time: 79.02 s, training_loss: 0.825
Epoch   23/50, time: 77.38 s, training_loss: 0.587
Epoch   23/50, time: 13.34 s, val_loss: 0.831
Epoch   23/50, time: 12.58 s, val_loss: 0.682
Epoch   24/50, time: 73.80 s, training_loss: 0.824
Epoch   24/50, time: 77.14 s, training_loss: 0.569
Epoch   24/50, time: 11.30 s, val_loss: 0.831
Epoch   24/50, time: 11.61 s, val_loss: 0.577
Epoch    9/50, time: 205.53 s, training_loss: 0.797
Epoch    9/50, time: 208.06 s, training_loss: 0.770
Epoch    9/50, time: 34.97 s, val_loss: 0.761
Epoch    9/50, time: 34.49 s, val_loss: 0.754
Epoch   25/50, time: 62.45 s, training_loss: 0.822
Epoch   25/50, time: 65.50 s, training_loss: 0.545
Epoch   25/50, time: 13.80 s, val_loss: 0.836
Epoch   25/50, time: 14.95 s, val_loss: 0.595
Epoch   26/50, time: 80.08 s, training_loss: 0.821
Epoch   26/50, time: 76.25 s, training_loss: 0.527
Epoch   26/50, time: 15.71 s, val_loss: 0.844
Epoch   26/50, time: 15.35 s, val_loss: 0.597
Epoch   27/50, time: 72.90 s, training_loss: 0.820
Epoch   27/50, time: 69.57 s, training_loss: 0.511
Epoch   10/50, time: 198.67 s, training_loss: 0.793
Epoch   27/50, time: 10.87 s, val_loss: 0.826
Epoch   27/50, time: 14.37 s, val_loss: 0.504
Epoch   10/50, time: 207.52 s, training_loss: 0.771
Epoch   10/50, time: 34.92 s, val_loss: 0.761
Epoch   10/50, time: 37.97 s, val_loss: 0.751
Epoch   28/50, time: 67.16 s, training_loss: 0.818
Epoch   28/50, time: 69.25 s, training_loss: 0.491
Epoch   28/50, time: 14.77 s, val_loss: 0.836
Epoch   28/50, time: 14.49 s, val_loss: 0.571
Epoch   29/50, time: 78.86 s, training_loss: 0.818
Epoch   29/50, time: 75.71 s, training_loss: 0.493
Epoch   29/50, time: 15.06 s, val_loss: 0.830
Epoch   29/50, time: 13.58 s, val_loss: 0.577
Epoch   11/50, time: 201.91 s, training_loss: 0.788
Epoch   30/50, time: 66.07 s, training_loss: 0.818
Epoch   30/50, time: 66.57 s, training_loss: 0.464
Epoch   11/50, time: 198.38 s, training_loss: 0.759
Epoch   30/50, time: 12.68 s, val_loss: 0.830
Epoch   30/50, time: 11.06 s, val_loss: 0.480
Epoch   11/50, time: 35.43 s, val_loss: 0.748
Epoch   11/50, time: 36.52 s, val_loss: 0.745
Epoch   31/50, time: 71.85 s, training_loss: 0.817
Epoch   31/50, time: 71.84 s, training_loss: 0.449
Epoch   31/50, time: 14.23 s, val_loss: 0.863
Epoch   31/50, time: 13.86 s, val_loss: 0.476
Training Metrics:
Accuracy: 0.6729
Precision: 0.0618
Recall: 0.9704
F1 Score: 0.1162
IoU: 0.0617
Dice Coefficient: 0.1162
Validation Metrics:
Accuracy: 0.5666
Precision: 0.0456
Recall: 0.9872
F1 Score: 0.0872
IoU: 0.0456
Dice Coefficient: 0.0872
Training Metrics:
Accuracy: 0.9443
Precision: 0.2464
Recall: 0.7358
F1 Score: 0.3692
IoU: 0.2264
Dice Coefficient: 0.3692
Validation Metrics:
Accuracy: 0.9487
Precision: 0.2479
Recall: 0.7100
F1 Score: 0.3675
IoU: 0.2251
Dice Coefficient: 0.3675
Epoch   32/50, time: 60.95 s, training_loss: 0.815
Epoch   32/50, time: 66.82 s, training_loss: 0.425
Epoch   32/50, time: 11.31 s, val_loss: 0.829
Epoch   32/50, time: 12.03 s, val_loss: 0.439
Training Metrics:
Accuracy: 0.7524
Precision: 0.0758
Recall: 0.9082
F1 Score: 0.1399
IoU: 0.0752
Dice Coefficient: 0.1399
Validation Metrics:
Accuracy: 0.9124
Precision: 0.1771
Recall: 0.8717
F1 Score: 0.2944
IoU: 0.1726
Dice Coefficient: 0.2944
Training Metrics:
Accuracy: 0.8248
Precision: 0.1060
Recall: 0.9285
F1 Score: 0.1903
IoU: 0.1051
Dice Coefficient: 0.1903
Validation Metrics:
Accuracy: 0.9050
Precision: 0.1700
Recall: 0.9089
F1 Score: 0.2864
IoU: 0.1671
Dice Coefficient: 0.2864
Epoch   33/50, time: 72.17 s, training_loss: 0.813
Epoch   33/50, time: 71.51 s, training_loss: 0.423
Epoch   33/50, time: 14.20 s, val_loss: 0.833
Epoch   33/50, time: 15.03 s, val_loss: 0.522
Epoch   34/50, time: 75.73 s, training_loss: 0.812
Epoch   34/50, time: 72.60 s, training_loss: 0.431
Epoch   34/50, time: 12.40 s, val_loss: 0.835
Epoch   34/50, time: 12.73 s, val_loss: 0.481
Epoch   12/50, time: 213.70 s, training_loss: 0.783
Epoch   12/50, time: 206.27 s, training_loss: 0.754
Epoch   35/50, time: 64.99 s, training_loss: 0.812
Epoch   35/50, time: 64.80 s, training_loss: 0.405
Epoch   35/50, time: 11.06 s, val_loss: 0.827
Epoch   35/50, time: 11.88 s, val_loss: 0.436
Epoch   12/50, time: 32.49 s, val_loss: 0.743
Epoch   12/50, time: 35.39 s, val_loss: 0.741
Epoch   36/50, time: 73.65 s, training_loss: 0.811
Epoch   36/50, time: 72.65 s, training_loss: 0.404
Epoch   36/50, time: 14.03 s, val_loss: 0.829
Epoch   36/50, time: 14.44 s, val_loss: 0.410
Epoch   37/50, time: 75.85 s, training_loss: 0.809
Epoch   37/50, time: 74.05 s, training_loss: 0.386
Epoch   37/50, time: 12.47 s, val_loss: 0.826
Epoch   37/50, time: 12.36 s, val_loss: 0.415
Epoch   13/50, time: 208.87 s, training_loss: 0.777
Epoch   13/50, time: 208.11 s, training_loss: 0.753
Epoch   38/50, time: 61.74 s, training_loss: 0.808
Epoch   38/50, time: 64.05 s, training_loss: 0.379
Epoch   38/50, time: 11.73 s, val_loss: 0.829
Epoch   13/50, time: 33.03 s, val_loss: 0.743
Epoch   38/50, time: 11.59 s, val_loss: 0.401
Epoch   13/50, time: 34.00 s, val_loss: 0.737
Epoch   39/50, time: 76.52 s, training_loss: 0.806
Epoch   39/50, time: 76.55 s, training_loss: 0.360
Epoch   39/50, time: 15.19 s, val_loss: 0.820
Epoch   39/50, time: 13.85 s, val_loss: 0.449
Epoch   40/50, time: 75.54 s, training_loss: 0.805
Epoch   40/50, time: 72.70 s, training_loss: 0.366
Epoch   40/50, time: 12.38 s, val_loss: 0.823
Epoch   40/50, time: 11.58 s, val_loss: 0.439
Epoch   14/50, time: 204.62 s, training_loss: 0.769
Epoch   14/50, time: 203.60 s, training_loss: 0.746
Epoch   41/50, time: 62.94 s, training_loss: 0.805
Epoch   14/50, time: 34.63 s, val_loss: 0.737
Epoch   41/50, time: 66.06 s, training_loss: 0.350
Epoch   14/50, time: 32.43 s, val_loss: 0.736
Epoch   41/50, time: 13.02 s, val_loss: 0.832
Epoch   41/50, time: 14.48 s, val_loss: 0.468
Training Metrics:
Accuracy: 0.7075
Precision: 0.0684
Recall: 0.9667
F1 Score: 0.1278
IoU: 0.0683
Dice Coefficient: 0.1278
Validation Metrics:
Accuracy: 0.6500
Precision: 0.0546
Recall: 0.9611
F1 Score: 0.1033
IoU: 0.0545
Dice Coefficient: 0.1033
Training Metrics:
Accuracy: 0.9686
Precision: 0.3748
Recall: 0.6246
F1 Score: 0.4685
IoU: 0.3059
Dice Coefficient: 0.4685
Validation Metrics:
Accuracy: 0.9606
Precision: 0.2963
Recall: 0.6369
F1 Score: 0.4044
IoU: 0.2535
Dice Coefficient: 0.4044
Epoch   42/50, time: 67.92 s, training_loss: 0.804
Epoch   15/50, time: 199.96 s, training_loss: 0.762
Epoch   42/50, time: 66.11 s, training_loss: 0.341
Epoch   15/50, time: 201.62 s, training_loss: 0.733
Epoch   42/50, time: 12.51 s, val_loss: 0.810
Epoch   42/50, time: 11.40 s, val_loss: 0.427
Epoch   15/50, time: 37.67 s, val_loss: 0.716
Epoch   15/50, time: 35.74 s, val_loss: 0.731
Epoch   43/50, time: 68.58 s, training_loss: 0.801
Epoch   43/50, time: 68.80 s, training_loss: 0.342
Epoch   43/50, time: 15.07 s, val_loss: 0.834
Epoch   43/50, time: 14.02 s, val_loss: 0.372
Epoch   44/50, time: 77.15 s, training_loss: 0.800
Epoch   44/50, time: 76.78 s, training_loss: 0.328
Epoch   44/50, time: 12.97 s, val_loss: 0.801
Epoch   44/50, time: 12.47 s, val_loss: 0.376
Epoch   16/50, time: 208.09 s, training_loss: 0.756
Epoch   45/50, time: 63.81 s, training_loss: 0.799
Epoch   16/50, time: 202.75 s, training_loss: 0.723
Epoch   45/50, time: 65.17 s, training_loss: 0.329
Epoch   45/50, time: 11.64 s, val_loss: 0.837
Epoch   45/50, time: 11.58 s, val_loss: 0.330
Epoch   16/50, time: 34.49 s, val_loss: 0.698
Epoch   16/50, time: 33.18 s, val_loss: 0.726
Epoch   46/50, time: 72.31 s, training_loss: 0.797
Epoch   46/50, time: 73.09 s, training_loss: 0.336
Epoch   46/50, time: 14.91 s, val_loss: 0.808
Epoch   46/50, time: 14.02 s, val_loss: 0.381
Epoch   47/50, time: 76.42 s, training_loss: 0.794
Epoch   47/50, time: 74.00 s, training_loss: 0.324
Epoch   47/50, time: 12.69 s, val_loss: 0.804
Epoch   47/50, time: 12.05 s, val_loss: 0.445
Epoch   17/50, time: 203.24 s, training_loss: 0.710
Epoch   17/50, time: 207.59 s, training_loss: 0.745
Epoch   48/50, time: 63.25 s, training_loss: 0.328
Epoch   48/50, time: 66.65 s, training_loss: 0.793
Epoch   48/50, time: 11.02 s, val_loss: 0.407
Epoch   48/50, time: 11.20 s, val_loss: 0.814
Epoch   17/50, time: 30.66 s, val_loss: 0.712
Epoch   17/50, time: 31.46 s, val_loss: 0.687
Epoch   49/50, time: 77.91 s, training_loss: 0.313
Epoch   49/50, time: 78.16 s, training_loss: 0.792
Epoch   49/50, time: 14.53 s, val_loss: 0.334
Epoch   49/50, time: 14.01 s, val_loss: 0.813
Epoch   50/50, time: 73.44 s, training_loss: 0.311
Epoch   50/50, time: 71.89 s, training_loss: 0.790
Epoch   50/50, time: 12.22 s, val_loss: 0.372
Epoch   50/50, time: 11.95 s, val_loss: 0.827
Epoch   18/50, time: 203.41 s, training_loss: 0.736
Epoch   18/50, time: 213.77 s, training_loss: 0.696
Epoch   18/50, time: 35.77 s, val_loss: 0.666
Epoch   18/50, time: 32.29 s, val_loss: 0.687
Training Metrics:
Accuracy: 0.9848
Precision: 0.6454
Recall: 0.6991
F1 Score: 0.6711
IoU: 0.5051
Dice Coefficient: 0.6711
Validation Metrics:
Accuracy: 0.9831
Precision: 0.5834
Recall: 0.6757
F1 Score: 0.6261
IoU: 0.4558
Dice Coefficient: 0.6261
Training Metrics:
Accuracy: 0.6959
Precision: 0.0624
Recall: 0.9066
F1 Score: 0.1167
IoU: 0.0620
Dice Coefficient: 0.1167
Validation Metrics:
Accuracy: 0.6147
Precision: 0.0473
Recall: 0.9083
F1 Score: 0.0900
IoU: 0.0471
Dice Coefficient: 0.0900
Test Metrics:
Accuracy: 0.9831
Precision: 0.5834
Recall: 0.6757
F1 Score: 0.6261
IoU: 0.4558
Dice Coefficient: 0.6261
wandb:
wandb: 🚀 View run trial_0_bs128_lr5e-04_dice_loss at: https://wandb.ai/sethih10-epfl/Extended_TERS_data_0.1/runs/ceo0lfsk
wandb: ⭐️ View project at: https://wandb.ai/sethih10-epfl/Extended_TERS_data_0.1
wandb: Synced 5 W&B file(s), 0 media file(s), 0 artifact file(s) and 0 other file(s)
wandb: Find logs at: ./wandb/run-20251026_114922-ceo0lfsk/logs
[I 2025-10-26 13:11:23,354] Trial 0 finished with value: 0.6261460745182981 and parameters: {'batch_size': 128, 'lr': 0.0004922998237932716, 'loss_fn': 'dice_loss', 'augmentation': True, 'filters_idx': 2, 'in_channels': 100, 'att_channels': 16}. Best is trial 0 with value: 0.6261460745182981.
wandb: Finishing previous runs because reinit is set to True.
Test Metrics:
Accuracy: 0.6147
Precision: 0.0473
Recall: 0.9083
F1 Score: 0.0900
IoU: 0.0471
Dice Coefficient: 0.0900
wandb:
wandb: 🚀 View run trial_1_bs128_lr4e-04_dice_loss at: https://wandb.ai/sethih10-epfl/Extended_TERS_data_0.1/runs/q051ljpk
wandb: ⭐️ View project at: https://wandb.ai/sethih10-epfl/Extended_TERS_data_0.1
wandb: Synced 5 W&B file(s), 0 media file(s), 0 artifact file(s) and 0 other file(s)
wandb: Find logs at: ./wandb/run-20251026_114922-q051ljpk/logs
wandb: Tracking run with wandb version 0.20.1
wandb: Run data is saved locally in /home/sethih1/masque_new/ters_gen/wandb/run-20251026_131123-m7tgc32u
wandb: Run `wandb offline` to turn off syncing.
wandb: Syncing run trial_4_bs128_lr3e-04_dice_loss
wandb: ⭐️ View project at https://wandb.ai/sethih10-epfl/Extended_TERS_data_0.1
wandb: 🚀 View run at https://wandb.ai/sethih10-epfl/Extended_TERS_data_0.1/runs/m7tgc32u
wandb: uploading data
wandb:
wandb:
wandb: Run history:
wandb: final_dice █▁
wandb:      trial ▁█
wandb:
wandb: Run summary:
wandb: final_dice 0.09001
wandb:      trial 2
wandb:
wandb: 🚀 View run trial_2_bs128_lr3e-05_dice_loss at: https://wandb.ai/sethih10-epfl/Extended_TERS_data_0.1/runs/84s6j0lw
wandb: ⭐️ View project at: https://wandb.ai/sethih10-epfl/Extended_TERS_data_0.1
wandb: Synced 5 W&B file(s), 0 media file(s), 0 artifact file(s) and 0 other file(s)
wandb: Find logs at: ./wandb/run-20251026_114922-84s6j0lw/logs
[I 2025-10-26 13:11:25,380] Trial 2 finished with value: 0.09000611687517289 and parameters: {'batch_size': 128, 'lr': 2.6291682688234377e-05, 'loss_fn': 'dice_loss', 'augmentation': True, 'filters_idx': 2, 'in_channels': 100, 'att_channels': 32}. Best is trial 0 with value: 0.6261460745182981.
Trial 4 using GPU 2
wandb: Tracking run with wandb version 0.20.1
wandb: Run data is saved locally in /home/sethih1/masque_new/ters_gen/wandb/run-20251026_131125-jre79vqq
wandb: Run `wandb offline` to turn off syncing.
wandb: Syncing run trial_5_bs128_lr5e-04_dice_loss
wandb: ⭐️ View project at https://wandb.ai/sethih10-epfl/Extended_TERS_data_0.1
wandb: 🚀 View run at https://wandb.ai/sethih10-epfl/Extended_TERS_data_0.1/runs/jre79vqq
Trial 5 using GPU 3
Epoch    1/50, time: 78.53 s, training_loss: 0.909
Epoch    1/50, time: 13.87 s, val_loss: 0.936
Epoch   19/50, time: 205.54 s, training_loss: 0.721
Epoch   19/50, time: 203.06 s, training_loss: 0.699
Epoch   19/50, time: 31.29 s, val_loss: 0.632
Epoch   19/50, time: 31.18 s, val_loss: 0.752
Training Metrics:
Accuracy: 0.9474
Precision: 0.1534
Recall: 0.3035
F1 Score: 0.2037
IoU: 0.1134
Dice Coefficient: 0.2037
Validation Metrics:
Accuracy: 0.9176
Precision: 0.1509
Recall: 0.6326
F1 Score: 0.2437
IoU: 0.1387
Dice Coefficient: 0.2437
Epoch    1/50, time: 201.95 s, training_loss: 0.884
Epoch    1/50, time: 39.11 s, val_loss: 0.939
Epoch    2/50, time: 74.44 s, training_loss: 0.879
Epoch    2/50, time: 15.31 s, val_loss: 0.894
Epoch    3/50, time: 74.64 s, training_loss: 0.864
Epoch    3/50, time: 14.23 s, val_loss: 0.868
Epoch   20/50, time: 207.09 s, training_loss: 0.710
Epoch   20/50, time: 211.27 s, training_loss: 0.685
Epoch   20/50, time: 31.81 s, val_loss: 0.613
Epoch    4/50, time: 60.73 s, training_loss: 0.852
Epoch   20/50, time: 34.07 s, val_loss: 0.678
Epoch    4/50, time: 14.42 s, val_loss: 0.850
Training Metrics:
Accuracy: 0.9739
Precision: 0.1594
Recall: 0.0413
F1 Score: 0.0656
IoU: 0.0339
Dice Coefficient: 0.0656
Validation Metrics:
Accuracy: 0.9721
Precision: 0.1569
Recall: 0.0757
F1 Score: 0.1022
IoU: 0.0538
Dice Coefficient: 0.1022
Epoch    5/50, time: 71.24 s, training_loss: 0.840
Epoch    5/50, time: 15.21 s, val_loss: 0.851
Epoch    6/50, time: 75.80 s, training_loss: 0.830
Epoch    6/50, time: 13.64 s, val_loss: 0.837
Epoch   21/50, time: 202.01 s, training_loss: 0.693
Epoch   21/50, time: 200.23 s, training_loss: 0.659
Epoch   21/50, time: 35.08 s, val_loss: 0.649
Epoch   21/50, time: 33.28 s, val_loss: 0.692
Epoch    7/50, time: 68.34 s, training_loss: 0.822
Epoch    7/50, time: 13.39 s, val_loss: 0.825
Epoch    2/50, time: 200.57 s, training_loss: 0.834
Epoch    2/50, time: 38.03 s, val_loss: 0.811
Epoch    8/50, time: 75.77 s, training_loss: 0.815
Epoch    8/50, time: 18.97 s, val_loss: 0.821
Epoch    9/50, time: 69.08 s, training_loss: 0.807
Epoch    9/50, time: 16.85 s, val_loss: 0.821
Training Metrics:
Accuracy: 0.9201
Precision: 0.2074
Recall: 0.9235
F1 Score: 0.3387
IoU: 0.2039
Dice Coefficient: 0.3387
Validation Metrics:
Accuracy: 0.9235
Precision: 0.2040
Recall: 0.9112
F1 Score: 0.3333
IoU: 0.2000
Dice Coefficient: 0.3333
Training Metrics:
Accuracy: 0.7690
Precision: 0.0703
Recall: 0.7709
F1 Score: 0.1289
IoU: 0.0689
Dice Coefficient: 0.1289
Validation Metrics:
Accuracy: 0.9571
Precision: 0.2824
Recall: 0.6794
F1 Score: 0.3990
IoU: 0.2492
Dice Coefficient: 0.3990
Epoch    3/50, time: 190.84 s, training_loss: 0.809
Epoch   10/50, time: 63.20 s, training_loss: 0.803
Epoch   10/50, time: 14.09 s, val_loss: 0.810
Epoch    3/50, time: 37.79 s, val_loss: 0.775
Epoch   11/50, time: 75.40 s, training_loss: 0.798
Epoch   11/50, time: 20.44 s, val_loss: 0.803
Epoch   22/50, time: 203.43 s, training_loss: 0.633
Epoch   22/50, time: 207.54 s, training_loss: 0.679
Training Metrics:
Accuracy: 0.9122
Precision: 0.1779
Recall: 0.8176
F1 Score: 0.2923
IoU: 0.1711
Dice Coefficient: 0.2923
Validation Metrics:
Accuracy: 0.9202
Precision: 0.1783
Recall: 0.7763
F1 Score: 0.2900
IoU: 0.1696
Dice Coefficient: 0.2900
Epoch   22/50, time: 33.63 s, val_loss: 0.636
Epoch   22/50, time: 32.60 s, val_loss: 0.615
Epoch    4/50, time: 198.59 s, training_loss: 0.794
Epoch    4/50, time: 37.53 s, val_loss: 0.768
Epoch   12/50, time: 68.30 s, training_loss: 0.790
Epoch   12/50, time: 15.54 s, val_loss: 0.786
Epoch   13/50, time: 78.22 s, training_loss: 0.782
Epoch   13/50, time: 14.33 s, val_loss: 0.794
Epoch   23/50, time: 207.34 s, training_loss: 0.610
Epoch   23/50, time: 204.26 s, training_loss: 0.655
Epoch   14/50, time: 63.56 s, training_loss: 0.775
Epoch   14/50, time: 10.68 s, val_loss: 0.776
Epoch   23/50, time: 32.00 s, val_loss: 0.605
Epoch   23/50, time: 30.83 s, val_loss: 0.571
Epoch    5/50, time: 195.80 s, training_loss: 0.785
Epoch    5/50, time: 38.49 s, val_loss: 0.792
Epoch   15/50, time: 73.88 s, training_loss: 0.768
Epoch   15/50, time: 15.75 s, val_loss: 0.763
Epoch   16/50, time: 73.23 s, training_loss: 0.762
Epoch   16/50, time: 14.95 s, val_loss: 0.772
Epoch   24/50, time: 202.83 s, training_loss: 0.649
Epoch   24/50, time: 213.42 s, training_loss: 0.587
Epoch   24/50, time: 32.83 s, val_loss: 0.604
Epoch   17/50, time: 63.19 s, training_loss: 0.755
Epoch   24/50, time: 30.77 s, val_loss: 0.601
Epoch    6/50, time: 200.73 s, training_loss: 0.777
Epoch   17/50, time: 12.79 s, val_loss: 0.755
Epoch    6/50, time: 38.67 s, val_loss: 0.788
Epoch   18/50, time: 75.56 s, training_loss: 0.747
Epoch   18/50, time: 14.27 s, val_loss: 0.756
Epoch   19/50, time: 78.10 s, training_loss: 0.739
Epoch   19/50, time: 13.79 s, val_loss: 0.735
Epoch   25/50, time: 206.61 s, training_loss: 0.628
Epoch   25/50, time: 205.54 s, training_loss: 0.574
Epoch   25/50, time: 32.28 s, val_loss: 0.584
Epoch   25/50, time: 31.21 s, val_loss: 0.575
Epoch    7/50, time: 197.92 s, training_loss: 0.760
Epoch   20/50, time: 66.51 s, training_loss: 0.729
Epoch   20/50, time: 13.71 s, val_loss: 0.729
Epoch    7/50, time: 34.21 s, val_loss: 0.760
Epoch   21/50, time: 79.38 s, training_loss: 0.720
Epoch   21/50, time: 19.67 s, val_loss: 0.728
Epoch   26/50, time: 203.77 s, training_loss: 0.545
Epoch   26/50, time: 210.51 s, training_loss: 0.615
Training Metrics:
Accuracy: 0.9153
Precision: 0.1993
Recall: 0.9350
F1 Score: 0.3285
IoU: 0.1965
Dice Coefficient: 0.3285
Validation Metrics:
Accuracy: 0.9197
Precision: 0.1977
Recall: 0.9253
F1 Score: 0.3258
IoU: 0.1946
Dice Coefficient: 0.3258
Epoch   26/50, time: 30.02 s, val_loss: 0.575
Epoch    8/50, time: 200.11 s, training_loss: 0.745
Epoch   26/50, time: 32.12 s, val_loss: 0.547
Epoch    8/50, time: 38.67 s, val_loss: 0.755
Epoch   22/50, time: 75.15 s, training_loss: 0.714
Epoch   22/50, time: 15.61 s, val_loss: 0.715
Epoch   23/50, time: 76.12 s, training_loss: 0.704
Epoch   23/50, time: 13.57 s, val_loss: 0.715
Epoch   27/50, time: 206.95 s, training_loss: 0.529
Epoch   27/50, time: 205.64 s, training_loss: 0.605
Epoch   27/50, time: 32.32 s, val_loss: 0.596
Epoch    9/50, time: 197.28 s, training_loss: 0.736
Epoch   24/50, time: 63.14 s, training_loss: 0.698
Epoch   27/50, time: 31.97 s, val_loss: 0.549
Epoch   24/50, time: 13.38 s, val_loss: 0.706
Epoch    9/50, time: 37.96 s, val_loss: 0.739
Epoch   25/50, time: 78.39 s, training_loss: 0.689
Epoch   25/50, time: 14.48 s, val_loss: 0.682
Epoch   26/50, time: 75.85 s, training_loss: 0.676
Epoch   26/50, time: 12.95 s, val_loss: 0.695
Epoch   28/50, time: 205.07 s, training_loss: 0.506
Epoch   28/50, time: 204.60 s, training_loss: 0.583
Epoch   28/50, time: 33.08 s, val_loss: 0.590
Epoch   10/50, time: 200.24 s, training_loss: 0.729
Epoch   28/50, time: 31.75 s, val_loss: 0.544
Epoch   27/50, time: 64.58 s, training_loss: 0.662
Epoch   10/50, time: 35.36 s, val_loss: 0.732
Epoch   27/50, time: 13.33 s, val_loss: 0.668
Epoch   28/50, time: 79.39 s, training_loss: 0.649
Epoch   28/50, time: 19.91 s, val_loss: 0.653
Epoch   29/50, time: 69.55 s, training_loss: 0.639
Epoch   29/50, time: 208.55 s, training_loss: 0.492
Epoch   29/50, time: 205.64 s, training_loss: 0.576
Epoch   29/50, time: 11.57 s, val_loss: 0.664
Epoch   29/50, time: 31.90 s, val_loss: 0.493
Epoch   29/50, time: 32.41 s, val_loss: 0.501
Epoch   11/50, time: 204.82 s, training_loss: 0.722
Epoch   11/50, time: 36.94 s, val_loss: 0.718
Epoch   30/50, time: 66.90 s, training_loss: 0.626
Epoch   30/50, time: 15.55 s, val_loss: 0.622
Epoch   31/50, time: 78.28 s, training_loss: 0.613
Epoch   31/50, time: 14.60 s, val_loss: 0.632
Epoch   30/50, time: 205.17 s, training_loss: 0.561
Epoch   30/50, time: 207.87 s, training_loss: 0.459
Epoch   30/50, time: 31.83 s, val_loss: 0.504
Epoch   30/50, time: 31.46 s, val_loss: 0.503
Training Metrics:
Accuracy: 0.9570
Precision: 0.3098
Recall: 0.7648
F1 Score: 0.4410
IoU: 0.2828
Dice Coefficient: 0.4410
Validation Metrics:
Accuracy: 0.9590
Precision: 0.3033
Recall: 0.7358
F1 Score: 0.4295
IoU: 0.2735
Dice Coefficient: 0.4295
Training Metrics:
Accuracy: 0.9033
Precision: 0.1756
Recall: 0.9099
F1 Score: 0.2943
IoU: 0.1726
Dice Coefficient: 0.2943
Validation Metrics:
Accuracy: 0.9093
Precision: 0.1759
Recall: 0.9021
F1 Score: 0.2943
IoU: 0.1726
Dice Coefficient: 0.2943
Epoch   32/50, time: 72.28 s, training_loss: 0.603
Epoch   32/50, time: 14.68 s, val_loss: 0.622
Epoch   33/50, time: 76.74 s, training_loss: 0.590
Epoch   33/50, time: 14.91 s, val_loss: 0.609
Epoch   31/50, time: 203.28 s, training_loss: 0.550
Epoch   31/50, time: 203.90 s, training_loss: 0.458
Epoch   31/50, time: 33.44 s, val_loss: 0.488
Epoch   31/50, time: 32.75 s, val_loss: 0.486
Epoch   34/50, time: 68.02 s, training_loss: 0.577
Epoch   12/50, time: 196.88 s, training_loss: 0.715
Epoch   34/50, time: 16.34 s, val_loss: 0.594
Epoch   12/50, time: 39.53 s, val_loss: 0.717
Epoch   35/50, time: 71.80 s, training_loss: 0.568
Epoch   35/50, time: 21.14 s, val_loss: 0.591
Epoch   36/50, time: 72.79 s, training_loss: 0.554
Epoch   36/50, time: 14.51 s, val_loss: 0.577
Epoch   13/50, time: 192.94 s, training_loss: 0.707
Training Metrics:
Accuracy: 0.8133
Precision: 0.0864
Recall: 0.7749
F1 Score: 0.1554
IoU: 0.0843
Dice Coefficient: 0.1554
Validation Metrics:
Accuracy: 0.9768
Precision: 0.4657
Recall: 0.7195
F1 Score: 0.5654
IoU: 0.3941
Dice Coefficient: 0.5654
Training Metrics:
Accuracy: 0.9754
Precision: 0.4616
Recall: 0.6656
F1 Score: 0.5451
IoU: 0.3747
Dice Coefficient: 0.5451
Validation Metrics:
Accuracy: 0.9767
Precision: 0.4598
Recall: 0.6249
F1 Score: 0.5298
IoU: 0.3604
Dice Coefficient: 0.5298
Epoch   37/50, time: 61.70 s, training_loss: 0.543
Epoch   37/50, time: 13.48 s, val_loss: 0.552
Epoch   13/50, time: 34.49 s, val_loss: 0.707
Epoch   38/50, time: 79.26 s, training_loss: 0.531
Epoch   38/50, time: 19.90 s, val_loss: 0.571
Epoch   39/50, time: 72.59 s, training_loss: 0.518
Epoch   32/50, time: 205.30 s, training_loss: 0.532
Epoch   32/50, time: 204.01 s, training_loss: 0.430
Epoch   39/50, time: 15.18 s, val_loss: 0.573
Epoch   14/50, time: 205.01 s, training_loss: 0.694
Epoch   32/50, time: 32.06 s, val_loss: 0.472
Epoch   32/50, time: 34.11 s, val_loss: 0.553
Epoch   14/50, time: 36.35 s, val_loss: 0.702
Epoch   40/50, time: 64.63 s, training_loss: 0.507
Epoch   40/50, time: 15.88 s, val_loss: 0.534
Epoch   41/50, time: 78.25 s, training_loss: 0.497
Epoch   41/50, time: 14.76 s, val_loss: 0.544
Epoch   33/50, time: 201.82 s, training_loss: 0.435
Epoch   33/50, time: 208.89 s, training_loss: 0.510
Epoch   15/50, time: 198.42 s, training_loss: 0.681
Epoch   33/50, time: 30.64 s, val_loss: 0.453
Epoch   33/50, time: 30.97 s, val_loss: 0.428
Training Metrics:
Accuracy: 0.9748
Precision: 0.4516
Recall: 0.6292
F1 Score: 0.5258
IoU: 0.3567
Dice Coefficient: 0.5258
Validation Metrics:
Accuracy: 0.9750
Precision: 0.4313
Recall: 0.6040
F1 Score: 0.5032
IoU: 0.3362
Dice Coefficient: 0.5032
Epoch   15/50, time: 38.71 s, val_loss: 0.677
Epoch   42/50, time: 78.48 s, training_loss: 0.490
Epoch   42/50, time: 14.71 s, val_loss: 0.527
Epoch   43/50, time: 77.13 s, training_loss: 0.476
Epoch   43/50, time: 12.07 s, val_loss: 0.517
Epoch   34/50, time: 208.20 s, training_loss: 0.397
Epoch   34/50, time: 206.96 s, training_loss: 0.499
Epoch   16/50, time: 199.14 s, training_loss: 0.666
Epoch   34/50, time: 31.23 s, val_loss: 0.487
Epoch   34/50, time: 30.84 s, val_loss: 0.448
Epoch   44/50, time: 61.16 s, training_loss: 0.469
Epoch   44/50, time: 13.75 s, val_loss: 0.484
Epoch   16/50, time: 35.40 s, val_loss: 0.666
Epoch   45/50, time: 78.88 s, training_loss: 0.451
Epoch   45/50, time: 20.55 s, val_loss: 0.484
Epoch   46/50, time: 70.85 s, training_loss: 0.445
Epoch   35/50, time: 200.56 s, training_loss: 0.488
Epoch   35/50, time: 208.93 s, training_loss: 0.395
Epoch   46/50, time: 13.37 s, val_loss: 0.485
Epoch   17/50, time: 202.46 s, training_loss: 0.643
Epoch   35/50, time: 33.58 s, val_loss: 0.440
Epoch   35/50, time: 32.13 s, val_loss: 0.423
Epoch   17/50, time: 36.37 s, val_loss: 0.665
Epoch   47/50, time: 65.45 s, training_loss: 0.448
Epoch   47/50, time: 16.05 s, val_loss: 0.483
Epoch   48/50, time: 77.90 s, training_loss: 0.433
Epoch   48/50, time: 16.96 s, val_loss: 0.462
Epoch   36/50, time: 207.02 s, training_loss: 0.387
Epoch   36/50, time: 212.71 s, training_loss: 0.501
Epoch   49/50, time: 66.67 s, training_loss: 0.423
Epoch   49/50, time: 13.07 s, val_loss: 0.453
Epoch   18/50, time: 200.13 s, training_loss: 0.610
Epoch   36/50, time: 30.86 s, val_loss: 0.398
Epoch   36/50, time: 34.20 s, val_loss: 0.493
Epoch   18/50, time: 35.91 s, val_loss: 0.640
Epoch   50/50, time: 70.86 s, training_loss: 0.415
Epoch   50/50, time: 15.77 s, val_loss: 0.444
Training Metrics:
Accuracy: 0.9771
Precision: 0.4894
Recall: 0.7937
F1 Score: 0.6055
IoU: 0.4342
Dice Coefficient: 0.6055
Validation Metrics:
Accuracy: 0.9766
Precision: 0.4656
Recall: 0.7667
F1 Score: 0.5794
IoU: 0.4078
Dice Coefficient: 0.5794
Test Metrics:
Accuracy: 0.9766
Precision: 0.4656
Recall: 0.7667
F1 Score: 0.5794
IoU: 0.4078
Dice Coefficient: 0.5794
wandb: uploading summary, console lines 384-390
wandb:
wandb: 🚀 View run trial_4_bs128_lr3e-04_dice_loss at: https://wandb.ai/sethih10-epfl/Extended_TERS_data_0.1/runs/m7tgc32u
wandb: ⭐️ View project at: https://wandb.ai/sethih10-epfl/Extended_TERS_data_0.1
wandb: Synced 5 W&B file(s), 0 media file(s), 0 artifact file(s) and 0 other file(s)
wandb: Find logs at: ./wandb/run-20251026_131123-m7tgc32u/logs
[I 2025-10-26 14:34:22,376] Trial 4 finished with value: 0.5793525346580544 and parameters: {'batch_size': 128, 'lr': 0.0002826115942214843, 'loss_fn': 'dice_loss', 'augmentation': True, 'filters_idx': 1, 'in_channels': 100, 'att_channels': 32}. Best is trial 0 with value: 0.6261460745182981.
wandb: Finishing previous runs because reinit is set to True.
wandb:
wandb:
wandb: Run history:
wandb: final_dice ▁
wandb:      trial ▁
wandb:
wandb: Run summary:
wandb: final_dice 0.57935
wandb:      trial 4
wandb:
wandb: 🚀 View run trial_5_bs128_lr5e-04_dice_loss at: https://wandb.ai/sethih10-epfl/Extended_TERS_data_0.1/runs/jre79vqq
wandb: ⭐️ View project at: https://wandb.ai/sethih10-epfl/Extended_TERS_data_0.1
wandb: Synced 5 W&B file(s), 0 media file(s), 0 artifact file(s) and 0 other file(s)
wandb: Find logs at: ./wandb/run-20251026_131125-jre79vqq/logs
wandb: Tracking run with wandb version 0.20.1
wandb: Run data is saved locally in /home/sethih1/masque_new/ters_gen/wandb/run-20251026_143422-tidp0jp1
wandb: Run `wandb offline` to turn off syncing.
wandb: Syncing run trial_6_bs128_lr7e-04_dice_loss
wandb: ⭐️ View project at https://wandb.ai/sethih10-epfl/Extended_TERS_data_0.1
wandb: 🚀 View run at https://wandb.ai/sethih10-epfl/Extended_TERS_data_0.1/runs/tidp0jp1
Epoch   37/50, time: 204.04 s, training_loss: 0.480
Epoch   37/50, time: 201.33 s, training_loss: 0.374
Trial 6 using GPU 2
Epoch   19/50, time: 197.20 s, training_loss: 0.596
Epoch   37/50, time: 32.50 s, val_loss: 0.446
Epoch   37/50, time: 34.38 s, val_loss: 0.409
Epoch   19/50, time: 35.68 s, val_loss: 0.596
Epoch    1/50, time: 66.71 s, training_loss: 0.882
Epoch    1/50, time: 15.66 s, val_loss: 0.908
Training Metrics:
Accuracy: 0.9251
Precision: 0.1553
Recall: 0.5357
F1 Score: 0.2407
IoU: 0.1368
Dice Coefficient: 0.2407
Validation Metrics:
Accuracy: 0.9173
Precision: 0.1542
Recall: 0.6555
F1 Score: 0.2496
IoU: 0.1426
Dice Coefficient: 0.2496
Epoch   38/50, time: 199.37 s, training_loss: 0.470
Epoch   38/50, time: 205.12 s, training_loss: 0.351
Epoch   20/50, time: 204.41 s, training_loss: 0.570
Epoch    2/50, time: 61.74 s, training_loss: 0.836
Epoch   38/50, time: 30.85 s, val_loss: 0.388
Epoch   38/50, time: 32.86 s, val_loss: 0.362
Epoch    2/50, time: 12.33 s, val_loss: 0.791
Epoch   20/50, time: 37.03 s, val_loss: 0.609
Epoch    3/50, time: 78.20 s, training_loss: 0.816
Epoch    3/50, time: 14.58 s, val_loss: 0.783
Epoch    4/50, time: 77.56 s, training_loss: 0.807
Epoch    4/50, time: 12.51 s, val_loss: 0.775
Epoch   39/50, time: 203.17 s, training_loss: 0.453
Epoch   39/50, time: 203.74 s, training_loss: 0.344
Epoch   39/50, time: 33.14 s, val_loss: 0.378
Epoch   21/50, time: 205.66 s, training_loss: 0.563
Epoch   39/50, time: 31.83 s, val_loss: 0.390
Epoch    5/50, time: 63.74 s, training_loss: 0.791
Epoch    5/50, time: 13.67 s, val_loss: 0.759
Epoch   21/50, time: 34.62 s, val_loss: 0.578
Epoch    6/50, time: 81.89 s, training_loss: 0.780
Epoch    6/50, time: 20.19 s, val_loss: 0.748
Epoch    7/50, time: 69.99 s, training_loss: 0.778
Epoch   40/50, time: 207.10 s, training_loss: 0.336
Epoch   40/50, time: 212.74 s, training_loss: 0.448
Epoch    7/50, time: 16.07 s, val_loss: 0.753
Epoch   40/50, time: 33.11 s, val_loss: 0.368
Epoch   40/50, time: 33.74 s, val_loss: 0.393
Epoch    8/50, time: 64.22 s, training_loss: 0.769
Epoch    8/50, time: 13.31 s, val_loss: 0.738
Training Metrics:
Accuracy: 0.9638
Precision: 0.3366
Recall: 0.6514
F1 Score: 0.4438
IoU: 0.2852
Dice Coefficient: 0.4438
Validation Metrics:
Accuracy: 0.9643
Precision: 0.3272
Recall: 0.6663
F1 Score: 0.4389
IoU: 0.2811
Dice Coefficient: 0.4389
Epoch    9/50, time: 78.82 s, training_loss: 0.759
Epoch    9/50, time: 14.04 s, val_loss: 0.741
Epoch   41/50, time: 206.72 s, training_loss: 0.439
Epoch   41/50, time: 211.50 s, training_loss: 0.324
Epoch   10/50, time: 66.19 s, training_loss: 0.744
Epoch   10/50, time: 11.66 s, val_loss: 0.734
Epoch   41/50, time: 33.72 s, val_loss: 0.379
Epoch   41/50, time: 31.73 s, val_loss: 0.369
Epoch   22/50, time: 195.97 s, training_loss: 0.533
Epoch   11/50, time: 68.10 s, training_loss: 0.733
Epoch   22/50, time: 37.72 s, val_loss: 0.567
Epoch   11/50, time: 15.69 s, val_loss: 0.719
Training Metrics:
Accuracy: 0.9196
Precision: 0.1810
Recall: 0.7451
F1 Score: 0.2913
IoU: 0.1705
Dice Coefficient: 0.2913
Validation Metrics:
Accuracy: 0.9241
Precision: 0.1842
Recall: 0.7638
F1 Score: 0.2969
IoU: 0.1743
Dice Coefficient: 0.2969
Epoch   23/50, time: 190.17 s, training_loss: 0.510
Epoch   12/50, time: 61.97 s, training_loss: 0.721
Epoch   12/50, time: 11.42 s, val_loss: 0.728
Training Metrics:
Accuracy: 0.8759
Precision: 0.1247
Recall: 0.7634
F1 Score: 0.2144
IoU: 0.1200
Dice Coefficient: 0.2144
Validation Metrics:
Accuracy: 0.9851
Precision: 0.6316
Recall: 0.6975
F1 Score: 0.6629
IoU: 0.4958
Dice Coefficient: 0.6629
Epoch   23/50, time: 31.46 s, val_loss: 0.516
Training Metrics:
Accuracy: 0.9835
Precision: 0.6192
Recall: 0.6697
F1 Score: 0.6434
IoU: 0.4743
Dice Coefficient: 0.6434
Validation Metrics:
Accuracy: 0.9841
Precision: 0.6100
Recall: 0.6713
F1 Score: 0.6392
IoU: 0.4697
Dice Coefficient: 0.6392
Epoch   13/50, time: 70.88 s, training_loss: 0.709
Epoch   13/50, time: 16.00 s, val_loss: 0.698
Epoch   14/50, time: 77.08 s, training_loss: 0.699
Epoch   14/50, time: 12.91 s, val_loss: 0.688
Epoch   42/50, time: 208.93 s, training_loss: 0.423
Epoch   24/50, time: 206.70 s, training_loss: 0.486
Epoch   42/50, time: 206.51 s, training_loss: 0.343
Epoch   15/50, time: 62.72 s, training_loss: 0.677
Epoch   15/50, time: 10.98 s, val_loss: 0.709
Epoch   42/50, time: 30.66 s, val_loss: 0.423
Epoch   24/50, time: 30.82 s, val_loss: 0.509
Epoch   42/50, time: 31.23 s, val_loss: 0.362
Epoch   16/50, time: 81.02 s, training_loss: 0.668
Epoch   16/50, time: 15.88 s, val_loss: 0.666
Epoch   17/50, time: 70.78 s, training_loss: 0.637
Epoch   17/50, time: 12.30 s, val_loss: 0.626
Epoch   43/50, time: 205.39 s, training_loss: 0.329
Epoch   43/50, time: 209.25 s, training_loss: 0.414
Epoch   25/50, time: 208.42 s, training_loss: 0.480
Epoch   18/50, time: 61.37 s, training_loss: 0.618
Epoch   43/50, time: 29.87 s, val_loss: 0.373
Epoch   25/50, time: 30.70 s, val_loss: 0.513
Epoch   43/50, time: 31.99 s, val_loss: 0.357
Epoch   18/50, time: 15.90 s, val_loss: 0.623
Epoch   19/50, time: 81.44 s, training_loss: 0.585
Epoch   19/50, time: 13.54 s, val_loss: 0.588
Epoch   20/50, time: 75.16 s, training_loss: 0.559
Epoch   20/50, time: 12.56 s, val_loss: 0.555
Epoch   44/50, time: 204.64 s, training_loss: 0.312
Epoch   26/50, time: 204.98 s, training_loss: 0.450
Epoch   44/50, time: 213.44 s, training_loss: 0.424
Epoch   26/50, time: 32.43 s, val_loss: 0.492
Epoch   44/50, time: 32.78 s, val_loss: 0.373
Epoch   44/50, time: 32.56 s, val_loss: 0.372
Epoch   21/50, time: 65.21 s, training_loss: 0.547
Epoch   21/50, time: 15.64 s, val_loss: 0.564
Training Metrics:
Accuracy: 0.9655
Precision: 0.3423
Recall: 0.6034
F1 Score: 0.4368
IoU: 0.2794
Dice Coefficient: 0.4368
Validation Metrics:
Accuracy: 0.9681
Precision: 0.3516
Recall: 0.6156
F1 Score: 0.4476
IoU: 0.2883
Dice Coefficient: 0.4476
Epoch   45/50, time: 200.95 s, training_loss: 0.309
Epoch   27/50, time: 203.81 s, training_loss: 0.424
Epoch   45/50, time: 201.82 s, training_loss: 0.426
Epoch   22/50, time: 61.96 s, training_loss: 0.535
Epoch   22/50, time: 11.17 s, val_loss: 0.613
Epoch   45/50, time: 30.95 s, val_loss: 0.337
Epoch   27/50, time: 31.61 s, val_loss: 0.497
Epoch   45/50, time: 33.76 s, val_loss: 0.485
Epoch   23/50, time: 78.41 s, training_loss: 0.496
Epoch   23/50, time: 15.99 s, val_loss: 0.604
Epoch   24/50, time: 72.33 s, training_loss: 0.488
Epoch   24/50, time: 12.18 s, val_loss: 0.507
Epoch   28/50, time: 206.93 s, training_loss: 0.431
Epoch   46/50, time: 213.41 s, training_loss: 0.289
Epoch   46/50, time: 204.75 s, training_loss: 0.439
Epoch   25/50, time: 60.68 s, training_loss: 0.453
Epoch   28/50, time: 30.90 s, val_loss: 0.616
Epoch   46/50, time: 31.80 s, val_loss: 0.335
Epoch   46/50, time: 30.61 s, val_loss: 0.393
Epoch   25/50, time: 12.45 s, val_loss: 0.569
Epoch   26/50, time: 80.14 s, training_loss: 0.443
Epoch   26/50, time: 14.59 s, val_loss: 0.453
Epoch   27/50, time: 75.71 s, training_loss: 0.427
Epoch   27/50, time: 12.49 s, val_loss: 0.439
Epoch   29/50, time: 206.35 s, training_loss: 0.429
Epoch   47/50, time: 208.89 s, training_loss: 0.296
Epoch   47/50, time: 209.61 s, training_loss: 0.399
Epoch   29/50, time: 33.61 s, val_loss: 0.422
Epoch   47/50, time: 31.37 s, val_loss: 0.419
Epoch   47/50, time: 32.40 s, val_loss: 0.367
Epoch   28/50, time: 62.47 s, training_loss: 0.419
Epoch   28/50, time: 15.70 s, val_loss: 0.467
Epoch   29/50, time: 79.36 s, training_loss: 0.394
Epoch   29/50, time: 20.81 s, val_loss: 0.419
Epoch   30/50, time: 69.54 s, training_loss: 0.378
Epoch   30/50, time: 208.35 s, training_loss: 0.382
Epoch   48/50, time: 205.35 s, training_loss: 0.318
Epoch   48/50, time: 204.03 s, training_loss: 0.405
Epoch   30/50, time: 15.42 s, val_loss: 0.383
Epoch   30/50, time: 32.97 s, val_loss: 0.468
Epoch   48/50, time: 32.26 s, val_loss: 0.471
Epoch   48/50, time: 32.39 s, val_loss: 0.408
Epoch   31/50, time: 68.77 s, training_loss: 0.351
Epoch   31/50, time: 15.81 s, val_loss: 0.415
Training Metrics:
Accuracy: 0.9801
Precision: 0.5415
Recall: 0.6528
F1 Score: 0.5920
IoU: 0.4205
Dice Coefficient: 0.5920
Validation Metrics:
Accuracy: 0.9813
Precision: 0.5466
Recall: 0.6428
F1 Score: 0.5908
IoU: 0.4193
Dice Coefficient: 0.5908
Epoch   49/50, time: 202.05 s, training_loss: 0.302
Epoch   31/50, time: 212.48 s, training_loss: 0.391
Epoch   49/50, time: 212.89 s, training_loss: 0.391
Epoch   32/50, time: 58.93 s, training_loss: 0.364
Epoch   49/50, time: 36.02 s, val_loss: 0.337
Epoch   32/50, time: 11.64 s, val_loss: 0.430
Epoch   31/50, time: 30.86 s, val_loss: 0.472
Epoch   49/50, time: 30.80 s, val_loss: 0.351
Epoch   33/50, time: 79.38 s, training_loss: 0.381
Epoch   33/50, time: 15.36 s, val_loss: 0.367
Epoch   34/50, time: 72.22 s, training_loss: 0.341
Epoch   34/50, time: 12.30 s, val_loss: 0.374
Epoch   50/50, time: 212.59 s, training_loss: 0.299
Epoch   50/50, time: 210.52 s, training_loss: 0.375
Epoch   35/50, time: 59.28 s, training_loss: 0.322
Epoch   50/50, time: 33.46 s, val_loss: 0.355
Epoch   50/50, time: 31.88 s, val_loss: 0.429
Epoch   35/50, time: 12.04 s, val_loss: 0.383
Training Metrics:
Accuracy: 0.9803
Precision: 0.5529
Recall: 0.5778
F1 Score: 0.5651
IoU: 0.3938
Dice Coefficient: 0.5651
Validation Metrics:
Accuracy: 0.9800
Precision: 0.5236
Recall: 0.5398
F1 Score: 0.5316
IoU: 0.3620
Dice Coefficient: 0.5316
Epoch   36/50, time: 75.57 s, training_loss: 0.335
Epoch   36/50, time: 15.07 s, val_loss: 0.366
Epoch   37/50, time: 76.19 s, training_loss: 0.328
Epoch   37/50, time: 12.53 s, val_loss: 0.380
Epoch   32/50, time: 199.99 s, training_loss: 0.374
Epoch   38/50, time: 62.26 s, training_loss: 0.307
Epoch   38/50, time: 11.13 s, val_loss: 0.360
Epoch   32/50, time: 32.10 s, val_loss: 0.401
Training Metrics:
Accuracy: 0.9863
Precision: 0.6796
Recall: 0.7264
F1 Score: 0.7022
IoU: 0.5411
Dice Coefficient: 0.7022
Validation Metrics:
Accuracy: 0.9850
Precision: 0.6322
Recall: 0.6771
F1 Score: 0.6538
IoU: 0.4857
Dice Coefficient: 0.6538
Training Metrics:
Accuracy: 0.9325
Precision: 0.2001
Recall: 0.6823
F1 Score: 0.3095
IoU: 0.1831
Dice Coefficient: 0.3095
Validation Metrics:
Accuracy: 0.9825
Precision: 0.5770
Recall: 0.6194
F1 Score: 0.5974
IoU: 0.4259
Dice Coefficient: 0.5974
Test Metrics:
Accuracy: 0.9850
Precision: 0.6322
Recall: 0.6771
F1 Score: 0.6538
IoU: 0.4857
Dice Coefficient: 0.6538
[I 2025-10-26 15:36:38,372] Trial 1 finished with value: 0.6538495126646442 and parameters: {'batch_size': 128, 'lr': 0.00035490052940988264, 'loss_fn': 'dice_loss', 'augmentation': True, 'filters_idx': 3, 'in_channels': 400, 'att_channels': 16}. Best is trial 1 with value: 0.6538495126646442.
wandb: Finishing previous runs because reinit is set to True.
wandb:
wandb:
wandb: Run history:
wandb: final_dice ▁
wandb:      trial ▁
wandb:
wandb: Run summary:
wandb: final_dice 0.65385
wandb:      trial 1
wandb:
wandb: 🚀 View run trial_6_bs128_lr7e-04_dice_loss at: https://wandb.ai/sethih10-epfl/Extended_TERS_data_0.1/runs/tidp0jp1
wandb: ⭐️ View project at: https://wandb.ai/sethih10-epfl/Extended_TERS_data_0.1
wandb: Synced 5 W&B file(s), 0 media file(s), 0 artifact file(s) and 0 other file(s)
wandb: Find logs at: ./wandb/run-20251026_143422-tidp0jp1/logs
wandb: Tracking run with wandb version 0.20.1
wandb: Run data is saved locally in /home/sethih1/masque_new/ters_gen/wandb/run-20251026_153638-kixdw2ti
wandb: Run `wandb offline` to turn off syncing.
wandb: Syncing run trial_7_bs128_lr2e-04_dice_loss
wandb: ⭐️ View project at https://wandb.ai/sethih10-epfl/Extended_TERS_data_0.1
wandb: 🚀 View run at https://wandb.ai/sethih10-epfl/Extended_TERS_data_0.1/runs/kixdw2ti
Trial 7 using GPU 0
Test Metrics:
Accuracy: 0.9825
Precision: 0.5770
Recall: 0.6194
F1 Score: 0.5974
IoU: 0.4259
Dice Coefficient: 0.5974
